{
  "card_id": "icu_design_context_hvac_uncertainty_007",
  "source_id": "adult_icu_design_2024_001",
  "source_title": "Society of Critical Care Medicine 2024 Guidelines on Adult ICU Design",
  "domain": "icu_design_context",
  "subdomain": "adult_icu_design",
  "population": "adult",
  "card_type": "design_context",
  "topic": "Advanced HVAC evidence uncertainty",
  "clinical_context": "Use only for ICU environment/design background, not clinical risk scoring.",
  "key_points": [
    "The source explicitly discusses advanced hvac evidence uncertainty as an adult ICU design issue.",
    "This card is excluded from RiskSentinelAgent default retrieval."
  ],
  "trigger_signals": [
    "HVAC"
  ],
  "related_risk_types": [],
  "used_by_agents": [
    "ClinicalSummaryAgent"
  ],
  "allowed_use": [
    "ICU design background",
    "environment context"
  ],
  "forbidden_use": [
    "risk scoring",
    "automatic clinical decision",
    "treatment order",
    "resource triage decision"
  ],
  "retrieval_keywords": [
    "heating, ventilation",
    "HVAC",
    "ICU design",
    "architecture"
  ],
  "evidence_location": {
    "page_start": 3,
    "page_end": 3,
    "section_title": "Adult ICU design",
    "quote": "HVAC = heating, ventilation, and air conditioning."
  },
  "confidence": "high",
  "human_review_required": true,
  "last_updated": "2026-05-08"
}
