{
  "related_risk_types": [],
  "allowed_use": [
    "risk explanation",
    "clinical summary",
    "human review escalation wording"
  ],
  "forbidden_use": [
    "automatic diagnosis",
    "treatment order",
    "drug dose recommendation",
    "automatic treatment decision"
  ],
  "confidence": "high",
  "human_review_required": true,
  "last_updated": "2026-05-08",
  "card_id": "general_icu_operations_summary_human_review_001",
  "source_id": "adult_icu_admission_triage_001",
  "source_title": "ICU Admission, Discharge, and Triage Guidelines",
  "domain": "general_icu_operations",
  "subdomain": "summary_safety",
  "population": "adult",
  "card_type": "icu_operations_context",
  "topic": "Operational summaries require human review",
  "clinical_context": "Use as a safety guardrail for clinical summary and ward coordination outputs.",
  "key_points": [
    "ICU admission, discharge, and triage guidance is designed to enhance operations, institutional policies, and research.",
    "Agent summaries should support human review and avoid autonomous ICU placement or discharge decisions."
  ],
  "trigger_signals": [
    "round summary",
    "bed management summary",
    "triage summary",
    "operational dashboard"
  ],
  "used_by_agents": [
    "ClinicalSummaryAgent",
    "WardCoordinatorAgent"
  ],
  "retrieval_keywords": [
    "ICU operations",
    "summary",
    "human review",
    "institutional policy",
    "triage"
  ],
  "evidence_location": {
    "page_start": 1,
    "page_end": 4,
    "section_title": "Title / Objectives",
    "quote": "enhance clinical operations"
  }
}
