{
  "card_id": "icu_design_context_surge_capacity_006",
  "source_id": "adult_icu_design_2024_001",
  "source_title": "Society of Critical Care Medicine 2024 Guidelines on Adult ICU Design",
  "domain": "icu_design_context",
  "subdomain": "adult_icu_design",
  "population": "adult",
  "card_type": "design_context",
  "topic": "Flexible surge capacity in ICU design",
  "clinical_context": "Use only for ICU environment/design background, not clinical risk scoring.",
  "key_points": [
    "The source explicitly discusses flexible surge capacity in icu design as an adult ICU design issue.",
    "This card is excluded from RiskSentinelAgent default retrieval."
  ],
  "trigger_signals": [
    "surge design"
  ],
  "related_risk_types": [],
  "used_by_agents": [
    "ClinicalSummaryAgent"
  ],
  "allowed_use": [
    "ICU design background",
    "environment context"
  ],
  "forbidden_use": [
    "risk scoring",
    "automatic clinical decision",
    "treatment order",
    "resource triage decision"
  ],
  "retrieval_keywords": [
    "surge capacity",
    "surge design",
    "ICU design",
    "architecture"
  ],
  "evidence_location": {
    "page_start": 6,
    "page_end": 6,
    "section_title": "Adult ICU design",
    "quote": "nosocomial infection, the panel established a GPS for 4.3. Should Flexible Surge Capacity vs. No"
  },
  "confidence": "high",
  "human_review_required": true,
  "last_updated": "2026-05-08"
}
